{"analysis_id":"coach.analysis.001","arrival_price":"512.20","coach_schema_version":1,"created_at":"2026-09-04T16:00:00Z","execution_grade":"OPTIMAL","fee_drag_bps":3,"instrument_id":"inst.us-equity.spy","market_impact_bps":5,"order_id":"ord.9b41","pre_trade_estimated_cost_bps":8,"realized_shortfall_bps":12,"realized_vwap":"512.40","slippage_drag_bps":4,"target_price":"512.25"}
